<?xml version="1.0" encoding="UTF-8"?>
<t24:meta-t24 mode="publish" xmlns:t24="http://www.temenos.com/t24-meta"
	xmlns:xsi="http://www.w3.org/2001/XMLSchema-instance"
	xsi:schemaLocation="http://www.temenos.com/t24-meta ../../t24-meta-models-gen/src/impl/domain/META-INF/schemas/meta-t24.xsd">

	<t24:domain-service-response>
		<t24:modules name="FT1">
			<t24:components name="Contract">
				<t24:applications name="FUNDS.TRANSFER">
					<t24:allowed-functions>IARDS</t24:allowed-functions>
					<t24:documentation>Main Table Associated with Funds Transfer
					</t24:documentation>
					<t24:fields name="CUSTOMER_ID">
						<t24:alignment>L</t24:alignment>
						<t24:concat-file>LMM.CUSTOMER</t24:concat-file>
						<t24:core>true</t24:core>
						<t24:documentation>TO DO</t24:documentation>
						<t24:input-behaviour>F</t24:input-behaviour>
						<t24:mandatory>true</t24:mandatory>
						<t24:max-length>10</t24:max-length>
						<t24:multi-language>false</t24:multi-language>
						<t24:name-t24>CUSTOMER.ID</t24:name-t24>
						<t24:primary-key>false</t24:primary-key>
						<t24:sys-number>1</t24:sys-number>
						<t24:type>S</t24:type>
						<t24:valid-value>
						<t24:value>1 RATE CHANGE</t24:value>
						</t24:valid-value>
						<t24:valid-value>
						</t24:valid-value>
					</t24:fields>
                    <t24:level>F</t24:level>
					<t24:non-stop>true</t24:non-stop>
					<t24:type>H</t24:type>
				</t24:applications>
			</t24:components>
		</t24:modules>
		<t24:t24-release>123</t24:t24-release>
	</t24:domain-service-response>
</t24:meta-t24>
